<?xml version="1.0"?>
<!DOCTYPE vegetation_description SYSTEM "file:C:\plot_database\veg_description.dtd">
<vegetation_description>
<plot_id>mike</plot_id>
<species>
<orig_species>john</orig_species>
<stratum>
<stratum_type>tree</stratum_type>
<percent_cover></percent_cover>
<dominance>
<id></id>
<layer_height></layer_height>
<physiogn_A></physiogn_A>
<physiogn_B></physiogn_B>
</dominance>
</stratum>
</species>
</vegetation_description>
